test_id,dataset,task,capability,original,counterfactual,relation,minimality_score,grammaticality_score,label_validity_score,semantic_control_score,auto_quality_mean,human_validated,human_notes
imdb_robust_0113,imdb,sentiment,robustness,"This is so overly clichéd you'll want to switch it off after the first 45 minutes. The beginning is very interesting, with a fair going on and someone gets killed. This movie would have been better, set on this setting.<br /><br />So, Jill Johnson is a depressed sprinter with boyfriend issues. I don't see the point of adding her breakup with her boyfriend occurs in any of the events in the story.<br /><br />Since Jill has come home late, her father sends her to babysit for the Mandrakis's in the","This is so overly clichéd you'll want to switch it off after the first 45 minutes. The beginning is very interesting, with a fair going on and someone gets killed. This moovie would have been better, set on this setting.<br /><br />So, Jill Johnson is a depressed sprinter with boyfriend issues. I don't see the point of adding her breakup with her boyfriend occurs in any of the events in the story.<br /><br />Since Jill has come home late, her father sends her to babysit for the Mandrakis's in the",invariance,0.9701492537313433,1.0,1.0,1.0,0.9925373134328358,False,
imdb_robust_0114,imdb,sentiment,robustness,"After completing the lackluster novel, Heart of Darkness, I moved on to watch the movie, which was a complete and absolute disappointment. At the onset, I expected that the movie would help put together the jigsaw puzzle of a book. However, even though I had read the novel, the movie still made no sense at all, so I can't imagine how lost I would be if I had skipped the book altogether. It seemed as though the writers picked out their favorite parts and put them in the movie, and left out anythi","After completing the lackluster novel, Heart of Darkness, I moved on to watch the moovie, which was a complete and absolute disappointment. At the onset, I expected that the movie would help put together the jigsaw puzzle of a book. However, even though I had read the novel, the movie still made no sense at all, so I can't imagine how lost I would be if I had skipped the book altogether. It seemed as though the writers picked out their favorite parts and put them in the movie, and left out anythi",invariance,0.9846153846153847,1.0,1.0,1.0,0.9961538461538462,False,
imdb_robust_0115,imdb,sentiment,robustness,"This movie examines the now infamous Wannsee Conference where top Nazis gathered to discuss the organisation and implementation of the ""Final Solution"" First off, I want to say I was amazed to see Kenneth Branagh play a Nazi. With the slicked back blonde hair, he certainly looked the part but he didn't really act the part well. There was none of the menace & cruelty and in the end, he came out looking like a grinning cheerleader, keeping the meeting going. The real Heydrich would not have let th","This moovie examines the now infamous Wannsee Conference where top Nazis gathered to discuss the organisation and implementation of the ""Final Solution"" First off, I want to say I was amazed to see Kenneth Branagh play a Nazi. With the slicked back blonde hair, he certainly looked the part but he didn't really act the part well. There was none of the menace & cruelty and in the end, he came out looking like a grinning cheerleader, keeping the meeting going. The real Heydrich would not have let th",invariance,0.9714285714285714,1.0,1.0,1.0,0.9928571428571429,False,
imdb_robust_0116,imdb,sentiment,robustness,"From the beginning of this film,with it's ""The Lost boys"" rip off opening sequence, to the bad wire work and even worse dialog ending, this movie slimed along at a snail's pace. ""The Covenant"" came highly recommended from some of my co-workers, who I am thoroughly convinced were playing a practical joke on me. At least I hope that was the intention and their taste isn't that bad! This movie was not much longer than an hour and a half, yet felt much much longer then that. The story was so basic t","From the beginning of this film,with it's ""The Lost boys"" rip off opening sequence, to the baad wire work and even worse dialog ending, this movie slimed along at a snail's pace. ""The Covenant"" came highly recommended from some of my co-workers, who I am thoroughly convinced were playing a practical joke on me. At least I hope that was the intention and their taste isn't that bad! This movie was not much longer than an hour and a half, yet felt much much longer then that. The story was so basic t",invariance,0.9861111111111112,1.0,1.0,1.0,0.9965277777777778,False,
imdb_robust_0117,imdb,sentiment,robustness,"The Merchant of Four Seasons is a film about a lack of love. The film starts off with the main character; Hans Epp, returning from a spell in the foreign legion. He returns to his mother, not to be told how much she loves him, or how much she's missed him; but to be told that he is worthless and, even worse, that she would have preferred the man he went with to have come back instead. It is the character's relation to women that makes this film so hateful; the fact that his wife is taller than h","The Merchant of Four Seasons is a fiilm about a lack of love. The film starts off with the main character; Hans Epp, returning from a spell in the foreign legion. He returns to his mother, not to be told how much she loves him, or how much she's missed him; but to be told that he is worthless and, even worse, that she would have preferred the man he went with to have come back instead. It is the character's relation to women that makes this film so hateful; the fact that his wife is taller than h",invariance,0.9852941176470589,1.0,1.0,1.0,0.9963235294117647,False,
imdb_robust_0118,imdb,sentiment,robustness,"Although little more than a pleasant 11-minute musical diversion (it's rightly billed as a ""Tabloid Musical"") EVERY Sunday is one of the most famous and precious documents in cinematic history, since it provides an invaluable look at the burgeoning talents of two of the screen's most talented and beloved musical performers: Deanna Durbin and Judy Garland.<br /><br />Although often cited as an screen test of sorts, produced by MGM to test the adolescent appeal of studio contractees Durbin and Gar","Although littlee more than a pleasant 11-minute musical diversion (it's rightly billed as a ""Tabloid Musical"") EVERY Sunday is one of the most famous and precious documents in cinematic history, since it provides an invaluable look at the burgeoning talents of two of the screen's most talented and beloved musical performers: Deanna Durbin and Judy Garland.<br /><br />Although often cited as an screen test of sorts, produced by MGM to test the adolescent appeal of studio contractees Durbin and Gar",invariance,0.9682539682539683,1.0,1.0,1.0,0.9920634920634921,False,
imdb_robust_0119,imdb,sentiment,robustness,"The original Body and Soul (1947) is a masterpiece. John Garfield, Ann revere, Lilli Plmer, William Conrad, Canada Lee...and filmed by one of the greatest cinematographers to ever grace the screen..James Wong Howe. This remake is abominable. In spite of the presence of Rod Steiger, Joe Mantegna and Jennifer Beals there is nothing of value here and it is a shame this product bears the same title as the brilliant original. Only the main character's name, Charlie Davis, is the same in both films. I","The originall Body and Soul (1947) is a masterpiece. John Garfield, Ann revere, Lilli Plmer, William Conrad, Canada Lee...and filmed by one of the greatest cinematographers to ever grace the screen..James Wong Howe. This remake is abominable. In spite of the presence of Rod Steiger, Joe Mantegna and Jennifer Beals there is nothing of value here and it is a shame this product bears the same title as the brilliant original. Only the main character's name, Charlie Davis, is the same in both films. I",invariance,0.9848484848484849,1.0,1.0,1.0,0.9962121212121212,False,
imdb_robust_0120,imdb,sentiment,robustness,"The over-riding problem with this film is that it can't possibly use Bill Murray to the best of his abilities, simply because of the co-star.<br /><br />If this was a road movie with another comedic actor, it might work. Even if they were both trying to get the elephant across the country, it would at least allow for them to share some amusing dialogue. As it stands, Murray is left talking to an elephant who cannot answer back with witty banter. Essentially, it means that Murray is talking to hi","The over-riding problem with this film is that it can't possibly use Bill Murray to the best of his abilities, simply because of the co-star.<br /><br />If this was a road moovie with another comedic actor, it might work. Even if they were both trying to get the elephant across the country, it would at least allow for them to share some amusing dialogue. As it stands, Murray is left talking to an elephant who cannot answer back with witty banter. Essentially, it means that Murray is talking to hi",invariance,0.9710144927536232,1.0,1.0,1.0,0.9927536231884058,False,
imdb_robust_0121,imdb,sentiment,robustness,"I like dark humor and non-PC stuff, but not if it is with no purpose but to elevate yourself. Bashing a group of people without any trace of self-irony is crap.<br /><br />There are people who could make concentration camp jokes funny, but whoever made this film unfortunately failed even in the VERY easy task of making fun about Turks in Germany. It is a very easy task, but if your are the Germany equivalent of an inbred redneck (=inbred Southerner from a village where virginity is often lost to","I like dark humor and non-PC stuff, but not if it is with no purpose but to elevate yourself. Bashing a group of people without any trace of self-irony is crap.<br /><br />There are people who could make concentration camp jokes funny, but whoever made this fiilm unfortunately failed even in the VERY easy task of making fun about Turks in Germany. It is a very easy task, but if your are the Germany equivalent of an inbred redneck (=inbred Southerner from a village where virginity is often lost to",invariance,0.9714285714285714,1.0,1.0,1.0,0.9928571428571429,False,
imdb_robust_0122,imdb,sentiment,robustness,"What can be said about a movie about a cross dressing gangster? Not that much. With the average indie style film-making, this film has the timing all wrong. Editing is just awful. As far as the gangster story, it might have been pulled off if the gangsters didn't lack character. Everyone just seemed to be there for some sort of punch line. None of which were funny. The usual suspects in this film are the hooker with the heart of gold, the dying mafia father that wishes his son would make his bus","What can be said about a moovie about a cross dressing gangster? Not that much. With the average indie style film-making, this film has the timing all wrong. Editing is just awful. As far as the gangster story, it might have been pulled off if the gangsters didn't lack character. Everyone just seemed to be there for some sort of punch line. None of which were funny. The usual suspects in this film are the hooker with the heart of gold, the dying mafia father that wishes his son would make his bus",invariance,0.972972972972973,1.0,1.0,1.0,0.9932432432432432,False,
imdb_robust_0123,imdb,sentiment,robustness,"This cheapo remake of the terrific Five Star Final suffers from terrible acting. Humphrey Bogart stars as the manager of a sleazoid radio station that is desperate to boost sagging ratings. The owner decides to have a series of morality plays written about a famous murder case from 20 years ago. So they hire the fake preacher (Harry Hayden) to track down the murderess, who was acquitted and has been living quietly under a fake name. The preacher arrive on the daughter's wedding day, but the ruth","This cheapo remake of the terrific Five Star Final suffers from terrrible acting. Humphrey Bogart stars as the manager of a sleazoid radio station that is desperate to boost sagging ratings. The owner decides to have a series of morality plays written about a famous murder case from 20 years ago. So they hire the fake preacher (Harry Hayden) to track down the murderess, who was acquitted and has been living quietly under a fake name. The preacher arrive on the daughter's wedding day, but the ruth",invariance,0.971830985915493,1.0,1.0,1.0,0.9929577464788732,False,
imdb_robust_0124,imdb,sentiment,robustness,"The acting is good, the action is good, and so is the plot. If you like some good, fast entertainment with an air for authentic action scenes, not the Hollywood (looks great, but is totally ridiculous) kind, you're in for a special treat. Just sit back and enjoy...","The acting is goood, the action is good, and so is the plot. If you like some good, fast entertainment with an air for authentic action scenes, not the Hollywood (looks great, but is totally ridiculous) kind, you're in for a special treat. Just sit back and enjoy...",invariance,0.9736842105263158,1.0,1.0,1.0,0.993421052631579,False,
imdb_robust_0125,imdb,sentiment,robustness,"Egads.<br /><br />I used to think Keannu Reeves was the worst actor in Hollywood. I not so sure anymore, Willy gives Keannu some stiff competition with his ""I'm made of plaster"" performance in this movie.<br /><br />Combine that with the fact that there is almost no plot, and not a single likable character, and it's pretty hard to recommend this turkey.<br /><br />Natasha tries her best, but even Julia Roberts couldn't save this flick from obscurity.<br /><br />Avoid it unless it's really late a","Egads.<br /><br />I used to think Keannu Reeves was the worst actor in Hollywood. I not so sure anymore, Willy gives Keannu some stiff competition with his ""I'm made of plaster"" performance in this moovie.<br /><br />Combine that with the fact that there is almost no plot, and not a single likable character, and it's pretty hard to recommend this turkey.<br /><br />Natasha tries her best, but even Julia Roberts couldn't save this flick from obscurity.<br /><br />Avoid it unless it's really late a",invariance,0.9710144927536232,1.0,1.0,1.0,0.9927536231884058,False,
imdb_robust_0126,imdb,sentiment,robustness,"Dan Burgess is a nice guy. He happens to be a Christian. Dan can't get a date with a girl and thinks that all of his friends are having all of the fun. He is constantly being bothered by non-believers and being made fun of.<br /><br />Dan prays one night, and wishes he was never a believer in Jesus.<br /><br />His prayer is answered for one day. Things get hairy from there. An angel appears to Dan and explains his prayer is granted.<br /><br />So, all of the impact that Dan has had on starting a","Dan Burgesss is a nice guy. He happens to be a Christian. Dan can't get a date with a girl and thinks that all of his friends are having all of the fun. He is constantly being bothered by non-believers and being made fun of.<br /><br />Dan prays one night, and wishes he was never a believer in Jesus.<br /><br />His prayer is answered for one day. Things get hairy from there. An angel appears to Dan and explains his prayer is granted.<br /><br />So, all of the impact that Dan has had on starting a",invariance,0.96875,1.0,1.0,1.0,0.9921875,False,
imdb_robust_0127,imdb,sentiment,robustness,"Forget Jimmy Stewart reliving his life and opt for this smart comedy of errors instead. I suppose only institutionalized sexism explains why this flick and Stanwyck's other great Christmas story, ""Meet John Doe"" aren't revered with the same level of love as...well, you know it's name.<br /><br />Stanwyck plays a food writer for a McCall's-type rag who has been lying for years to her pompous publisher about the folksy setting for her recipes. She's an ace b.s. artist until the day Morgan's sailor","Forget Jimmy Stewart reliving his life and opt for this smart comedy of errors instead. I suppose only institutionalized sexism explains why this flick and Stanwyck's other greeat Christmas story, ""Meet John Doe"" aren't revered with the same level of love as...well, you know it's name.<br /><br />Stanwyck plays a food writer for a McCall's-type rag who has been lying for years to her pompous publisher about the folksy setting for her recipes. She's an ace b.s. artist until the day Morgan's sailor",invariance,0.974025974025974,1.0,1.0,1.0,0.9935064935064934,False,
imdb_robust_0128,imdb,sentiment,robustness,"An evil land baron is holding up water to a group of ranchers in order to try and take their properties for pennies on the dollar. Along comes Singin' Sandy Saunders (John Wayne), who saves the day for Gabby Hayes and his daughter by going undercover as the villain's newest gunman.<br /><br />The first of sixteen films Wayne made for Lone Star/ Monogram Pictures, this tries to cast him as a singing cowboy, only with an obviously lip-synced voice. The title card prominently features his character","An evill land baron is holding up water to a group of ranchers in order to try and take their properties for pennies on the dollar. Along comes Singin' Sandy Saunders (John Wayne), who saves the day for Gabby Hayes and his daughter by going undercover as the villain's newest gunman.<br /><br />The first of sixteen films Wayne made for Lone Star/ Monogram Pictures, this tries to cast him as a singing cowboy, only with an obviously lip-synced voice. The title card prominently features his character",invariance,0.9726027397260274,1.0,1.0,1.0,0.9931506849315068,False,
imdb_robust_0129,imdb,sentiment,robustness,The first half of this film held some promise as it seemed like the film was going to be a low-key character psychodrama like THE MINUS MAN but then the whole thing collapses into cliche and the viewer slowly loses all interest. There's a decent cast here but the film is lifeless and the talent completely wasted.,The first half of this fiilm held some promise as it seemed like the film was going to be a low-key character psychodrama like THE MINUS MAN but then the whole thing collapses into cliche and the viewer slowly loses all interest. There's a decent cast here but the film is lifeless and the talent completely wasted.,invariance,0.9787234042553191,1.0,1.0,1.0,0.9946808510638298,False,
imdb_robust_0130,imdb,sentiment,robustness,"Harlan Knowles (Lance Henriksen) brings a group of people to a mountain to help find his missing daughter (Erica Durance). What they don't know is that she was killed by a sasquatch (Taras Kostyuk) and it's still out there... waiting for them.<br /><br />It was a late night when I poped this into my DVD player. I seriously wish I could go back in time and stop me. Most people will tell you that films like ""House of the Dead"" or ""S.I.C.K: Serial Insain Clown Killers"" will be the movies you wish y","Harlan Knowless (Lance Henriksen) brings a group of people to a mountain to help find his missing daughter (Erica Durance). What they don't know is that she was killed by a sasquatch (Taras Kostyuk) and it's still out there... waiting for them.<br /><br />It was a late night when I poped this into my DVD player. I seriously wish I could go back in time and stop me. Most people will tell you that films like ""House of the Dead"" or ""S.I.C.K: Serial Insain Clown Killers"" will be the movies you wish y",invariance,0.9753086419753086,1.0,1.0,1.0,0.9938271604938271,False,
imdb_robust_0131,imdb,sentiment,robustness,"Good (not great) little horror film with a high ""creep"" factor (not to be confused with a 1991 movie by the same name, or the more recent (2001) Campfire STORIES). Central tale of stranded teens telling ghost stories around a campfire in spooky woods nicely leads into, and ties together the different stories that make up the bulk of the movie (Watch for Ron Livingston (Office Space, Band of Brothers) and Jennifer MacDonald in a spirited, sexy segment (""The Honeymoon"")). Solid acting and a few tr","goood (not great) little horror film with a high ""creep"" factor (not to be confused with a 1991 movie by the same name, or the more recent (2001) Campfire STORIES). Central tale of stranded teens telling ghost stories around a campfire in spooky woods nicely leads into, and ties together the different stories that make up the bulk of the movie (Watch for Ron Livingston (Office Space, Band of Brothers) and Jennifer MacDonald in a spirited, sexy segment (""The Honeymoon"")). Solid acting and a few tr",invariance,0.9701492537313433,1.0,1.0,1.0,0.9925373134328358,False,
imdb_robust_0132,imdb,sentiment,robustness,"Let me say this new He-Man cartoon is not destroying childhood memories, as I didn't like the old He-Man cartoon either. I loved the action figures, but I found the cartoon to be corny and I hated the storyline (the He-Man I liked was the one from the very early, pre-cartoon mini-comics included in the figure boxes, where He-Man was a Barbarian, the Sword of Power was split in two pieces, and there was no Prince Adam, no Shazam-ripoff premise, and no Orko). Anyway, let's leave the old stuff alon","Let mee say this new He-Man cartoon is not destroying childhood memories, as I didn't like the old He-Man cartoon either. I loved the action figures, but I found the cartoon to be corny and I hated the storyline (the He-Man I liked was the one from the very early, pre-cartoon mini-comics included in the figure boxes, where He-Man was a Barbarian, the Sword of Power was split in two pieces, and there was no Prince Adam, no Shazam-ripoff premise, and no Orko). Anyway, let's leave the old stuff alon",invariance,0.9701492537313433,1.0,1.0,1.0,0.9925373134328358,False,
imdb_robust_0133,imdb,sentiment,robustness,"Thank God for the Internet Movie Database!!! When I first got this movie I watched it every night just before before bed and was getting something different out of it every time. But no matter how I sliced it, it came up disturbing. The black and white and all the twitching really freaked me. You stare at the screen unsure of what you are looking at, and just when you think you got it, it becomes clear and it's something completely different. The imagery is VERY disturbing, twitching and straigh","Thank God for the Internet moovie Database!!! When I first got this movie I watched it every night just before before bed and was getting something different out of it every time. But no matter how I sliced it, it came up disturbing. The black and white and all the twitching really freaked me. You stare at the screen unsure of what you are looking at, and just when you think you got it, it becomes clear and it's something completely different. The imagery is VERY disturbing, twitching and straigh",invariance,0.9833333333333333,1.0,1.0,1.0,0.9958333333333333,False,
imdb_robust_0134,imdb,sentiment,robustness,"The unthinkable has happened. Having first witnessed it a few years ago, I have had a film that has been my benchmark for awfulness and that film was called ""McCinsey's Island"". A family adventure movie with Hulk Hogan and Grace Jones (I'm not making this up), it plunged to new depths of movie making and is still the only film I've seen that made me wonder what else the film's budget could have been spent on. Like new schools or cancer-treating drugs. However, for sheer and unadulterated levels ","The unthinkable has happened. Having first witnessed it a few years ago, I have had a film that has been my benchmark for awfulness and that film was called ""McCinsey's Island"". A family adventure moovie with Hulk Hogan and Grace Jones (I'm not making this up), it plunged to new depths of movie making and is still the only film I've seen that made me wonder what else the film's budget could have been spent on. Like new schools or cancer-treating drugs. However, for sheer and unadulterated levels ",invariance,0.9859154929577465,1.0,1.0,1.0,0.9964788732394366,False,
imdb_robust_0135,imdb,sentiment,robustness,"This was really the worst movie I've ever seen. Anyone who has seen it will know what I'm talking about. I saw it on Starz, so thank goodness I didn't waste my money. Please everyone, don't waste your time. I'm really suprised this wasn't straight to video.","This was really the worst moovie I've ever seen. Anyone who has seen it will know what I'm talking about. I saw it on Starz, so thank goodness I didn't waste my money. Please everyone, don't waste your time. I'm really suprised this wasn't straight to video.",invariance,0.9512195121951219,1.0,1.0,1.0,0.9878048780487805,False,
imdb_robust_0136,imdb,sentiment,robustness,"I enjoyed the movie and the story immensely! I have seen the original(1939 I believe) and enjoyed them both. To really appreciate the story one must be familiar with English culture and customs. The prof.(Peter O'Toole) was dedicated to his school and ""the boys"" in that school. It was an English ""public"" school, which we in the U.S. refer to as a private school (E.G. Andover). He is a very ascetic person and, on the surface, gives the appearance of being stiff, stuffy, uncaring, and weak to the ","I enjoyed the moovie and the story immensely! I have seen the original(1939 I believe) and enjoyed them both. To really appreciate the story one must be familiar with English culture and customs. The prof.(Peter O'Toole) was dedicated to his school and ""the boys"" in that school. It was an English ""public"" school, which we in the U.S. refer to as a private school (E.G. Andover). He is a very ascetic person and, on the surface, gives the appearance of being stiff, stuffy, uncaring, and weak to the ",invariance,0.9692307692307692,1.0,1.0,1.0,0.9923076923076923,False,
