test_id,dataset,task,capability,original,counterfactual,relation,minimality_score,grammaticality_score,label_validity_score,semantic_control_score,auto_quality_mean,human_validated,human_notes
qqp_bench_0078,qqp,paraphrase,semantic_equivalence,"How can you tell if someone is active on Bumble? [SEP] How long should you wait to sign into tinder/bumble/hinge after a good first date, knowing they can see your activity status?","How can you tell if someone is active on Bumble? [SEP] How long should you wait to sign into tinder/bumble/hinge after a good first date, knowing they can see your activity status?",invariance,1.0,1.0,1.0,1.0,1.0,False,
qqp_bench_0079,qqp,paraphrase,semantic_equivalence,What is Express.js and Angular.js? [SEP] How does Angular JS fit with Express JS?,What is Express.js and Angular.js? [SEP] How does Angular JS fit with Express JS?,invariance,1.0,1.0,1.0,1.0,1.0,False,
qqp_bench_0080,qqp,paraphrase,semantic_equivalence,Which country's citizenship is easy to acquire for Indians? [SEP] Can an Indian citizen acquire citizenship for other countries?,Which country's citizenship is easy to acquire for Indians? [SEP] Can an Indian citizen acquire citizenship for other countries?,invariance,1.0,1.0,1.0,1.0,1.0,False,
qqp_bench_0081,qqp,paraphrase,semantic_equivalence,Why does my boyfriend sit around with his hand down his pants? [SEP] How do I convince my boyfriend to stop sagging his pants?,Why does my boyfriend sit around with his hand down his pants? [SEP] How do I convince my boyfriend to stop sagging his pants?,invariance,1.0,1.0,1.0,1.0,1.0,False,
qqp_bench_0082,qqp,paraphrase,semantic_equivalence,What are your New Year's resolutions for 2017? [SEP] What are some new year resolutions for 2017?,What are your New Year's resolutions for 2017? [SEP] What are some new year resolutions for 2017?,invariance,1.0,1.0,1.0,1.0,1.0,False,
qqp_bench_0083,qqp,paraphrase,semantic_equivalence,Are there any health benefits from marijuana? [SEP] Are there any proven health benefits in taking in marijuana?,Are there any health benefits from marijuana? [SEP] Are there any proven health benefits in taking in marijuana?,invariance,1.0,1.0,1.0,1.0,1.0,False,
qqp_bench_0084,qqp,paraphrase,semantic_equivalence,"Which college is better among Hindu College and Hans Raj College of Delhi University for doing BA (Hons.) in economics? [SEP] Do companies which come for placement at Hindu college, Delhi University also hire articles for articleship among students pursuing CA?","Which college is better among Hindu College and Hans Raj College of Delhi University for doing BA (Hons.) in economics? [SEP] Do companies which come for placement at Hindu college, Delhi University also hire articles for articleship among students pursuing CA?",invariance,1.0,1.0,1.0,1.0,1.0,False,
qqp_bench_0085,qqp,paraphrase,semantic_equivalence,What is the best training institutes for tool design course? [SEP] Govt job for software engineers?,What is the best training institutes for tool design course? [SEP] Govt job for software engineers?,invariance,1.0,1.0,1.0,1.0,1.0,False,
qqp_bench_0086,qqp,paraphrase,semantic_equivalence,When did Quora start? [SEP] How long was the development cycle for the initial launch of Quora?,When did Quora start? [SEP] How long was the development cycle for the initial launch of Quora?,invariance,1.0,1.0,1.0,1.0,1.0,False,
qqp_bench_0087,qqp,paraphrase,semantic_equivalence,How often do people travel between Chicago and Milwaukee? [SEP] How often do people travel between Milwaukee and Madison?,How often do people travel between Chicago and Milwaukee? [SEP] How often do people travel between Milwaukee and Madison?,invariance,1.0,1.0,1.0,1.0,1.0,False,
qqp_bench_0088,qqp,paraphrase,semantic_equivalence,Why do I never have nightmares? [SEP] Why don't I get nightmares?,Why do I never have nightmares? [SEP] Why don't I get nightmares?,invariance,1.0,1.0,1.0,1.0,1.0,False,
qqp_bench_0089,qqp,paraphrase,semantic_equivalence,What should I know about Linux before joining Amazon as an SDE? [SEP] Does Amazon really give 3 lakh after joining as an SDE?,What should I know about Linux before joining Amazon as an SDE? [SEP] Does Amazon really give 3 lakh after joining as an SDE?,invariance,1.0,1.0,1.0,1.0,1.0,False,
qqp_bench_0090,qqp,paraphrase,semantic_equivalence,Am I blocked if I can't follow anyone on Instagram? [SEP] How do I get free Instagram followers fast?,Am I blocked if I can't follow anyone on Instagram? [SEP] How do I get free Instagram followers fast?,invariance,1.0,1.0,1.0,1.0,1.0,False,
qqp_bench_0091,qqp,paraphrase,semantic_equivalence,Why is J JAYALALITHA is like a God in Tamil Nadu? What is the reason behind this popularity? [SEP] Why was Jayalalithaa so famous in Tamil Nadu?,Why is J JAYALALITHA is like a God in Tamil Nadu? What is the reason behind this popularity? [SEP] Why was Jayalalithaa so famous in Tamil Nadu?,invariance,1.0,1.0,1.0,1.0,1.0,False,
qqp_bench_0092,qqp,paraphrase,semantic_equivalence,"In the wake of the Fort Lauderdale airport shooting, do we need to rethink airport security measures? [SEP] How is a mass shooting like the one at the Fort Lauderdale airport possible with today's security upgrades?","In the wake of the Fort Lauderdale airport shooting, do we need to rethink airport security measures? [SEP] How is a mass shooting like the one at the Fort Lauderdale airport possible with today's security upgrades?",invariance,1.0,1.0,1.0,1.0,1.0,False,
qqp_bench_0093,qqp,paraphrase,semantic_equivalence,How can I find all my Gmail IDs? [SEP] How can you find all of your Gmail accounts?,How can I find all my Gmail IDs? [SEP] How can you find all of your Gmail accounts?,invariance,1.0,1.0,1.0,1.0,1.0,False,
qqp_bench_0094,qqp,paraphrase,semantic_equivalence,How did World War Two start? [SEP] What will most likely cause World War III?,How did World War Two start? [SEP] What will most likely cause World War III?,invariance,1.0,1.0,1.0,1.0,1.0,False,
qqp_bench_0095,qqp,paraphrase,semantic_equivalence,"What's the difference between Computer Engineering and Computer Science degree? [SEP] What is the difference between computer science, computer engineering, and software engineering?","What's the difference between Computer Engineering and Computer Science degree? [SEP] What is the difference between computer science, computer engineering, and software engineering?",invariance,1.0,1.0,1.0,1.0,1.0,False,
qqp_bench_0096,qqp,paraphrase,semantic_equivalence,"How advertising design? [SEP] Which would you say is heavier, a pound of cotton or a pound of gold?","How advertising design? [SEP] Which would you say is heavier, a pound of cotton or a pound of gold?",invariance,1.0,1.0,1.0,1.0,1.0,False,
qqp_bench_0097,qqp,paraphrase,semantic_equivalence,How do you calculate your net worth? [SEP] How do I calculate my net worth?,How do you calculate your net worth? [SEP] How do I calculate my net worth?,invariance,1.0,1.0,1.0,1.0,1.0,False,
qqp_bench_0098,qqp,paraphrase,semantic_equivalence,What is limestone? How is limestone formed? [SEP] What is limestone? How is it formed?,What is limestone? How is limestone formed? [SEP] What is limestone? How is it formed?,invariance,1.0,1.0,1.0,1.0,1.0,False,
qqp_bench_0099,qqp,paraphrase,semantic_equivalence,Letter for apology for not giving exams? [SEP] What's the definitive version of The Flash?,Letter for apology for not giving exams? [SEP] What's the definitive version of The Flash?,invariance,1.0,1.0,1.0,1.0,1.0,False,
qqp_bench_0100,qqp,paraphrase,semantic_equivalence,How does a structure differ from an array in c programming? [SEP] What is an array? And how is it used in C programming?,How does a structure differ from an array in c programming? [SEP] What is an array? And how is it used in C programming?,invariance,1.0,1.0,1.0,1.0,1.0,False,
qqp_bench_0101,qqp,paraphrase,semantic_equivalence,What are the best website for downloading free games? [SEP] What is best website for downloading games?,What are the best website for downloading free games? [SEP] What is best website for downloading games?,invariance,1.0,1.0,1.0,1.0,1.0,False,
qqp_bench_0102,qqp,paraphrase,semantic_equivalence,"How can I pick up my USPS package before it is delivered? [SEP] If my package is delivered to the local post office, how long is it before it gets shipped to me?","How can I pick up my USPS package before it is delivered? [SEP] If my package is delivered to the local post office, how long is it before it gets shipped to me?",invariance,1.0,1.0,1.0,1.0,1.0,False,
qqp_bench_0103,qqp,paraphrase,semantic_equivalence,"""If 110/70 is normal blood pressure, what is the normal range for the """"low number"""" for a young female adult?"" [SEP] Why do females have low blood pressure as compared to the men?","""If 110/70 is normal blood pressure, what is the normal range for the """"low number"""" for a young female adult?"" [SEP] Why do females have low blood pressure as compared to the men?",invariance,1.0,1.0,1.0,1.0,1.0,False,
qqp_bench_0104,qqp,paraphrase,semantic_equivalence,Are cousins allowed inside Infosys Mysore campus? [SEP] Are bikes allowed inside infosys mysore campus?,Are cousins allowed inside Infosys Mysore campus? [SEP] Are bikes allowed inside infosys mysore campus?,invariance,1.0,1.0,1.0,1.0,1.0,False,
qqp_bench_0105,qqp,paraphrase,semantic_equivalence,Which is the official language of India? [SEP] What are the official languages of India?,Which is the official language of India? [SEP] What are the official languages of India?,invariance,1.0,1.0,1.0,1.0,1.0,False,
qqp_bench_0106,qqp,paraphrase,semantic_equivalence,Can I make money by uploading videos on YouTube (if I have subscribers)? [SEP] How do I make money through YouTube?,Can I make money by uploading videos on YouTube (if I have subscribers)? [SEP] How do I make money through YouTube?,invariance,1.0,1.0,1.0,1.0,1.0,False,
qqp_bench_0107,qqp,paraphrase,semantic_equivalence,"Two cards are drawn without replacement from a deck. What is the probability that the first one is a heart if we know we drew no more than one heart? [SEP] Consider a jar with 3 red balls, 7 purple balls, 2 green balls, and 4 blue balls. If two balls are drawn at random, what is the probability that without replacement, a blue ball will be drawn twice?","Two cards are drawn without replacement from a deck. What is the probability that the first one is a heart if we know we drew no more than one heart? [SEP] Consider a jar with 3 red balls, 7 purple balls, 2 green balls, and 4 blue balls. If two balls are drawn at random, what is the probability that without replacement, a blue ball will be drawn twice?",invariance,1.0,1.0,1.0,1.0,1.0,False,
qqp_bench_0108,qqp,paraphrase,semantic_equivalence,"What was time before the Big Bang? [SEP] If time didn't exist before the Big Bang, how could the Big Bang possibly have happened?","What was time before the Big Bang? [SEP] If time didn't exist before the Big Bang, how could the Big Bang possibly have happened?",invariance,1.0,1.0,1.0,1.0,1.0,False,
qqp_bench_0109,qqp,paraphrase,semantic_equivalence,How can I prevent my car's gas tank from overflowing when filled? [SEP] My wife poured a half gallon of kerosene into my car's gas tank. Will it be okay?,How can I prevent my car's gas tank from overflowing when filled? [SEP] My wife poured a half gallon of kerosene into my car's gas tank. Will it be okay?,invariance,1.0,1.0,1.0,1.0,1.0,False,
qqp_bench_0110,qqp,paraphrase,semantic_equivalence,"What are the arguments against wearing a rosary as a necklace? [SEP] Is it offensive to wear a rosary as a necklace? If so, why?","What are the arguments against wearing a rosary as a necklace? [SEP] Is it offensive to wear a rosary as a necklace? If so, why?",invariance,1.0,1.0,1.0,1.0,1.0,False,
qqp_bench_0111,qqp,paraphrase,semantic_equivalence,What in the world is wrong with you? [SEP] What is wrong with the world?,What in the world is wrong with you? [SEP] What is wrong with the world?,invariance,1.0,1.0,1.0,1.0,1.0,False,
qqp_bench_0112,qqp,paraphrase,semantic_equivalence,What does crocodile taste like? [SEP] How did crocodiles spread across 4 continents?,What does crocodile taste like? [SEP] How did crocodiles spread across 4 continents?,invariance,1.0,1.0,1.0,1.0,1.0,False,
qqp_bench_0113,qqp,paraphrase,semantic_equivalence,"Is demat account necessary for investing in mutual funds? Are there any additional benefits of having demat account for investing in mutual funds? [SEP] What are the brokerages that we are supposed to pay in a mutual fund? Once I have a Demat account, what are the charges I am supposed to pay for further transactions?","Is demat account necessary for investing in mutual funds? Are there any additional benefits of having demat account for investing in mutual funds? [SEP] What are the brokerages that we are supposed to pay in a mutual fund? Once I have a Demat account, what are the charges I am supposed to pay for further transactions?",invariance,1.0,1.0,1.0,1.0,1.0,False,
qqp_bench_0114,qqp,paraphrase,semantic_equivalence,Do you think that the demonetization policy will backfire for BJP in 2019 elections? [SEP] Will demonetization pull down BJP vote share in 2019 general elections?,Do you think that the demonetization policy will backfire for BJP in 2019 elections? [SEP] Will demonetization pull down BJP vote share in 2019 general elections?,invariance,1.0,1.0,1.0,1.0,1.0,False,
qqp_bench_0115,qqp,paraphrase,semantic_equivalence,What content do people want to see in articles and on what topics? [SEP] What A/B testing features do content publishers/producers use the most and/or want to see?,What content do people want to see in articles and on what topics? [SEP] What A/B testing features do content publishers/producers use the most and/or want to see?,invariance,1.0,1.0,1.0,1.0,1.0,False,
qqp_bench_0116,qqp,paraphrase,semantic_equivalence,Does Jony Ive use an iPhone 7 or an iPhone 7 Plus? [SEP] What is your review of the new iPhone 7/iPhone 7 Plus?,Does Jony Ive use an iPhone 7 or an iPhone 7 Plus? [SEP] What is your review of the new iPhone 7/iPhone 7 Plus?,invariance,1.0,1.0,1.0,1.0,1.0,False,
qqp_bench_0117,qqp,paraphrase,semantic_equivalence,Why did the Harry Potter movies never win an Oscar in any category? [SEP] What are some scenes from the Harry Potter movies that were planned or even filmed but never made it to the screen?,Why did the Harry Potter movies never win an Oscar in any category? [SEP] What are some scenes from the Harry Potter movies that were planned or even filmed but never made it to the screen?,invariance,1.0,1.0,1.0,1.0,1.0,False,
qqp_bench_0118,qqp,paraphrase,semantic_equivalence,Can anyone guide me? [SEP] Can anyone guide me for workout?,Can anyone guide me? [SEP] Can anyone guide me for workout?,invariance,1.0,1.0,1.0,1.0,1.0,False,
qqp_bench_0119,qqp,paraphrase,semantic_equivalence,Why one shouldn’t watch movies? [SEP] How should I avoid watching movies?,Why one shouldn’t watch movies? [SEP] How should I avoid watching movies?,invariance,1.0,1.0,1.0,1.0,1.0,False,
qqp_bench_0120,qqp,paraphrase,semantic_equivalence,How do I stop caring about what people think about me? [SEP] How do I stop worrying about future?,How do I stop caring about what people think about me? [SEP] How do I stop worrying about future?,invariance,1.0,1.0,1.0,1.0,1.0,False,
qqp_bench_0121,qqp,paraphrase,semantic_equivalence,"""Why does it say """"INRI"""" on Jesus's cross?"" [SEP] Why does it say on instagram that a username is unavailable when it just got deleted?","""Why does it say """"INRI"""" on Jesus's cross?"" [SEP] Why does it say on instagram that a username is unavailable when it just got deleted?",invariance,1.0,1.0,1.0,1.0,1.0,False,
qqp_bench_0122,qqp,paraphrase,semantic_equivalence,What was the production of artwork intended for in Hawaii and how is it compared to the one intended for in Pennsylvania? [SEP] What was the production of artwork intended for in Hawaii and how is it compared to the one intended for in Maine?,What was the production of artwork intended for in Hawaii and how is it compared to the one intended for in Pennsylvania? [SEP] What was the production of artwork intended for in Hawaii and how is it compared to the one intended for in Maine?,invariance,1.0,1.0,1.0,1.0,1.0,False,
qqp_bench_0123,qqp,paraphrase,semantic_equivalence,Do schools kill creativity? [SEP] Does school kills creativity?,Do schools kill creativity? [SEP] Does school kills creativity?,invariance,1.0,1.0,1.0,1.0,1.0,False,
qqp_bench_0124,qqp,paraphrase,semantic_equivalence,Have you ever seen a ghost while going in a car? [SEP] Have you ever seen a ghost/spirit while totally awake?,Have you ever seen a ghost while going in a car? [SEP] Have you ever seen a ghost/spirit while totally awake?,invariance,1.0,1.0,1.0,1.0,1.0,False,
qqp_bench_0125,qqp,paraphrase,semantic_equivalence,What are the best safe proxy servers? [SEP] Which is the best proxy server to use?,What are the best safe proxy servers? [SEP] Which is the best proxy server to use?,invariance,1.0,1.0,1.0,1.0,1.0,False,
qqp_bench_0126,qqp,paraphrase,semantic_equivalence,What is the national language of India? [SEP] Which is the national language of India?,What is the national language of India? [SEP] Which is the national language of India?,invariance,1.0,1.0,1.0,1.0,1.0,False,
qqp_bench_0127,qqp,paraphrase,semantic_equivalence,Does dark matter exist on earth? [SEP] Could dark matter exist in small clumps here on Earth?,Does dark matter exist on earth? [SEP] Could dark matter exist in small clumps here on Earth?,invariance,1.0,1.0,1.0,1.0,1.0,False,
qqp_bench_0128,qqp,paraphrase,semantic_equivalence,What are some examples of onomatopoeia? [SEP] What is onomatopoeia? What are some examples?,What are some examples of onomatopoeia? [SEP] What is onomatopoeia? What are some examples?,invariance,1.0,1.0,1.0,1.0,1.0,False,
qqp_bench_0129,qqp,paraphrase,semantic_equivalence,When will moto G3 (Moto G 3rd gen 2015) get Android 7.0 (Nougat) update? [SEP] Will the Moto X STYLE (PURE) get the Android nougat update?,When will moto G3 (Moto G 3rd gen 2015) get Android 7.0 (Nougat) update? [SEP] Will the Moto X STYLE (PURE) get the Android nougat update?,invariance,1.0,1.0,1.0,1.0,1.0,False,
qqp_bench_0130,qqp,paraphrase,semantic_equivalence,Wat is subsidy? [SEP] Which is the best coaching institute in Delhi for GATE in Computer Science stream?,Wat is subsidy? [SEP] Which is the best coaching institute in Delhi for GATE in Computer Science stream?,invariance,1.0,1.0,1.0,1.0,1.0,False,
qqp_bench_0131,qqp,paraphrase,semantic_equivalence,How much minimum marks i need in neet 2016 to get admission in private medical college as well as govt college ? [SEP] How much marks is required to get admission in private medical college through neet?,How much minimum marks i need in neet 2016 to get admission in private medical college as well as govt college ? [SEP] How much marks is required to get admission in private medical college through neet?,invariance,1.0,1.0,1.0,1.0,1.0,False,
qqp_bench_0132,qqp,paraphrase,semantic_equivalence,How come the requirements on Game-Debate are so inaccurate? [SEP] What are the scariest new games to come out?,How come the requirements on Game-Debate are so inaccurate? [SEP] What are the scariest new games to come out?,invariance,1.0,1.0,1.0,1.0,1.0,False,
qqp_bench_0133,qqp,paraphrase,semantic_equivalence,How was your tinder experience? [SEP] How was your experience using Tinder for dating?,How was your tinder experience? [SEP] How was your experience using Tinder for dating?,invariance,1.0,1.0,1.0,1.0,1.0,False,
qqp_bench_0134,qqp,paraphrase,semantic_equivalence,"If people of age 60 have an affair despite of having wife and grownup children, how can we trust marriages? [SEP] Without having an affair, what are the other avenues of love/affection/caring you can hope to get if you feel your wife is not fully providing you with your required amount to be satisfied?","If people of age 60 have an affair despite of having wife and grownup children, how can we trust marriages? [SEP] Without having an affair, what are the other avenues of love/affection/caring you can hope to get if you feel your wife is not fully providing you with your required amount to be satisfied?",invariance,1.0,1.0,1.0,1.0,1.0,False,
qqp_bench_0135,qqp,paraphrase,semantic_equivalence,Which semi-successful Silicon Valley startups are actually slowly dying? [SEP] How does living in the Silicon Valley bubble reduce your startup's chance of success?,Which semi-successful Silicon Valley startups are actually slowly dying? [SEP] How does living in the Silicon Valley bubble reduce your startup's chance of success?,invariance,1.0,1.0,1.0,1.0,1.0,False,
qqp_bench_0136,qqp,paraphrase,semantic_equivalence,India how many states? [SEP] How many states and union territories are there in India?,India how many states? [SEP] How many states and union territories are there in India?,invariance,1.0,1.0,1.0,1.0,1.0,False,
qqp_bench_0137,qqp,paraphrase,semantic_equivalence,"Who is more Influential according to you Newton or Einstein? [SEP] Who has had the larger influence, Isaac Newton or Albert Einstein?","Who is more Influential according to you Newton or Einstein? [SEP] Who has had the larger influence, Isaac Newton or Albert Einstein?",invariance,1.0,1.0,1.0,1.0,1.0,False,
qqp_bench_0138,qqp,paraphrase,semantic_equivalence,What are some modern examples of government corruption in Greece? [SEP] What are some modern examples of government corruption in China?,What are some modern examples of government corruption in Greece? [SEP] What are some modern examples of government corruption in China?,invariance,1.0,1.0,1.0,1.0,1.0,False,
qqp_bench_0139,qqp,paraphrase,semantic_equivalence,Which are the Best Known Drop Shipping Companies in India for Retail eCommerce? [SEP] What is the best Indian shipping service for ecommerce?,Which are the Best Known Drop Shipping Companies in India for Retail eCommerce? [SEP] What is the best Indian shipping service for ecommerce?,invariance,1.0,1.0,1.0,1.0,1.0,False,
qqp_bench_0140,qqp,paraphrase,semantic_equivalence,What are the five best pieces of advice you have received? [SEP] What is the best piece of advice you have ever received?,What are the five best pieces of advice you have received? [SEP] What is the best piece of advice you have ever received?,invariance,1.0,1.0,1.0,1.0,1.0,False,
qqp_bench_0141,qqp,paraphrase,semantic_equivalence,How much is the salary/compensation enjoyed by Sultans of the states in Malaysia? What other benefits and privileges do they enjoy from their respective state? [SEP] How much does a bellboy make in Malaysia?,How much is the salary/compensation enjoyed by Sultans of the states in Malaysia? What other benefits and privileges do they enjoy from their respective state? [SEP] How much does a bellboy make in Malaysia?,invariance,1.0,1.0,1.0,1.0,1.0,False,
qqp_bench_0142,qqp,paraphrase,semantic_equivalence,Where can I buy good cheap LED bulb? [SEP] Where I can get cheap LED filament bulbs?,Where can I buy good cheap LED bulb? [SEP] Where I can get cheap LED filament bulbs?,invariance,1.0,1.0,1.0,1.0,1.0,False,
qqp_bench_0143,qqp,paraphrase,semantic_equivalence,How does a capacitor correct a power factor? [SEP] How static capacitor banks improve power factor?,How does a capacitor correct a power factor? [SEP] How static capacitor banks improve power factor?,invariance,1.0,1.0,1.0,1.0,1.0,False,
qqp_bench_0144,qqp,paraphrase,semantic_equivalence,"Why hasn't he contacted me at all for two days after our date where he tried to kiss me and texted that nite that he had a lot of fun? [SEP] If a man texted five minutes after the first date to say he had fun, why won't he text me the next day? How can he be trying to play it cool now?","Why hasn't he contacted me at all for two days after our date where he tried to kiss me and texted that nite that he had a lot of fun? [SEP] If a man texted five minutes after the first date to say he had fun, why won't he text me the next day? How can he be trying to play it cool now?",invariance,1.0,1.0,1.0,1.0,1.0,False,
qqp_bench_0145,qqp,paraphrase,semantic_equivalence,Is it offensive if a white person wears henna? [SEP] Name some of the most famous horse trainers in the world?,Is it offensive if a white person wears henna? [SEP] Name some of the most famous horse trainers in the world?,invariance,1.0,1.0,1.0,1.0,1.0,False,
qqp_bench_0146,qqp,paraphrase,semantic_equivalence,How would scrapping Rs 500 and 1000 notes affect the real estate sector? [SEP] How does the demonetized notes of 500 and 1000 effect the real estate?,How would scrapping Rs 500 and 1000 notes affect the real estate sector? [SEP] How does the demonetized notes of 500 and 1000 effect the real estate?,invariance,1.0,1.0,1.0,1.0,1.0,False,
qqp_bench_0147,qqp,paraphrase,semantic_equivalence,What should I do about my hoarding parents? [SEP] What should I do about my hoarding mother?,What should I do about my hoarding parents? [SEP] What should I do about my hoarding mother?,invariance,1.0,1.0,1.0,1.0,1.0,False,
qqp_bench_0148,qqp,paraphrase,semantic_equivalence,Where are the places for sandwich massage parlours in Mumbai? [SEP] Is going to a massage parlor equal to cheating for a married person?,Where are the places for sandwich massage parlours in Mumbai? [SEP] Is going to a massage parlor equal to cheating for a married person?,invariance,1.0,1.0,1.0,1.0,1.0,False,
qqp_bench_0149,qqp,paraphrase,semantic_equivalence,Zoology: What is the purpose of a goat's beard? [SEP] Why do goats wag their tails?,Zoology: What is the purpose of a goat's beard? [SEP] Why do goats wag their tails?,invariance,1.0,1.0,1.0,1.0,1.0,False,
