test_id,dataset,task,capability,original,counterfactual,relation,minimality_score,grammaticality_score,label_validity_score,semantic_control_score,auto_quality_mean,human_validated,human_notes
mnli_bench_0052,mnli,nli,semantic_role_sensitivity,"On a December day in 1917, British General Allenby rode up to Jaffa Gate and dismounted from his horse because he would not ride where Jesus walked; he then accepted the surrender of the city after the Ottoman Turks had fled (the flag of surrender was a bed-sheet from the American Colony Hotel). [SEP] In 1917, the Brittish General Allenby surrendered the city using a bed-sheet.","On a December day in 1917, British General Allenby rode up to Jaffa Gate and dismounted from his horse because he would not ride where Jesus walked; he then accepted the surrender of the city after the Ottoman Turks had fled (the flag of surrender was a bed-sheet from the American Colony Hotel). [SEP] In 1917, the Brittish General Allenby surrendered the city using a bed-sheet.",invariance,1.0,1.0,1.0,1.0,1.0,False,
mnli_bench_0053,mnli,nli,semantic_role_sensitivity,Daniel took it upon himself to explain a few things. [SEP] Daniel explained what was happening.,Daniel took it upon himself to explain a few things. [SEP] Daniel explained what was happening.,invariance,1.0,1.0,1.0,1.0,1.0,False,
mnli_bench_0054,mnli,nli,semantic_role_sensitivity,yep same here [SEP] That never happened to me.,yep same here [SEP] That never happened to me.,invariance,1.0,1.0,1.0,1.0,1.0,False,
mnli_bench_0055,mnli,nli,semantic_role_sensitivity,because then they'll or you have a prescription [SEP] You would have a prescription.,because then they'll or you have a prescription [SEP] You would have a prescription.,invariance,1.0,1.0,1.0,1.0,1.0,False,
mnli_bench_0056,mnli,nli,semantic_role_sensitivity,well it's a pleasure talking with you [SEP] It's lovely speaking with you. ,well it's a pleasure talking with you [SEP] It's lovely speaking with you. ,invariance,1.0,1.0,1.0,1.0,1.0,False,
mnli_bench_0057,mnli,nli,semantic_role_sensitivity,"By seeding packs with a few high-value cards, the manufacturer is encouraging kids to buy Pokemon cards like lottery tickets. [SEP] Each Pokemon card pack is filled with every rare card a kid could want.","By seeding packs with a few high-value cards, the manufacturer is encouraging kids to buy Pokemon cards like lottery tickets. [SEP] Each Pokemon card pack is filled with every rare card a kid could want.",invariance,1.0,1.0,1.0,1.0,1.0,False,
mnli_bench_0058,mnli,nli,semantic_role_sensitivity,He reported masterfully on the '72 campaign and the Hell's Angels. [SEP] He generally reports very well on all kinds of things.,He reported masterfully on the '72 campaign and the Hell's Angels. [SEP] He generally reports very well on all kinds of things.,invariance,1.0,1.0,1.0,1.0,1.0,False,
mnli_bench_0059,mnli,nli,semantic_role_sensitivity,"The final rule was determined to be an economically significant regulatory action by the Office of Management and Budget and was approved by OMB as complying with the requirements of the Order on March 26, 1998. [SEP] The final rule was declared not to be an economically significant regulator action.","The final rule was determined to be an economically significant regulatory action by the Office of Management and Budget and was approved by OMB as complying with the requirements of the Order on March 26, 1998. [SEP] The final rule was declared not to be an economically significant regulator action.",invariance,1.0,1.0,1.0,1.0,1.0,False,
mnli_bench_0060,mnli,nli,semantic_role_sensitivity,"well Dana it's been really interesting and i appreciate talking with you [SEP] Dana, this conversation bored me.","well Dana it's been really interesting and i appreciate talking with you [SEP] Dana, this conversation bored me.",invariance,1.0,1.0,1.0,1.0,1.0,False,
mnli_bench_0061,mnli,nli,semantic_role_sensitivity,"The dramatic cliffs of the Serra de Tramuntana mountain range hug the coastline of the entire northwest and north, from Andratx all the way to the Cape of Formentor. [SEP] Andratx is on the northwest coast and the Cape of Formentor is further east.","The dramatic cliffs of the Serra de Tramuntana mountain range hug the coastline of the entire northwest and north, from Andratx all the way to the Cape of Formentor. [SEP] Andratx is on the northwest coast and the Cape of Formentor is further east.",invariance,1.0,1.0,1.0,1.0,1.0,False,
mnli_bench_0062,mnli,nli,semantic_role_sensitivity,"Keep young skins safe by covering them with sunblock or a T-shirt, even when in the water. [SEP] Sunblock is an unnecessary precaution if you are in the water.","Keep young skins safe by covering them with sunblock or a T-shirt, even when in the water. [SEP] Sunblock is an unnecessary precaution if you are in the water.",invariance,1.0,1.0,1.0,1.0,1.0,False,
mnli_bench_0063,mnli,nli,semantic_role_sensitivity,"In the short term, U.S. consumers will benefit from cheap imports (as will U.S. multinationals that use parts made in East Asian factories). [SEP] U.S. consumers and factories in East Asia benefit from imports.","In the short term, U.S. consumers will benefit from cheap imports (as will U.S. multinationals that use parts made in East Asian factories). [SEP] U.S. consumers and factories in East Asia benefit from imports.",invariance,1.0,1.0,1.0,1.0,1.0,False,
mnli_bench_0064,mnli,nli,semantic_role_sensitivity,Diets for men in their prime [SEP] Healthy eating choices for optimally aged men. ,Diets for men in their prime [SEP] Healthy eating choices for optimally aged men. ,invariance,1.0,1.0,1.0,1.0,1.0,False,
mnli_bench_0065,mnli,nli,semantic_role_sensitivity,"Four or five from the town rode past, routed by their diminished numbers and the fury of the Kal and Thorn. [SEP] Kal and Thorn were very angry.","Four or five from the town rode past, routed by their diminished numbers and the fury of the Kal and Thorn. [SEP] Kal and Thorn were very angry.",invariance,1.0,1.0,1.0,1.0,1.0,False,
mnli_bench_0066,mnli,nli,semantic_role_sensitivity,Several of its beaches are officially designated for nudism (known locally as naturisme) the most popular being Pointe Tarare and a functionary who is a Chevalier de la L??gion d'Honneur has been appointed to supervise all aspects of sunning in the buff. [SEP] There are no people who sun in the bluff.,Several of its beaches are officially designated for nudism (known locally as naturisme) the most popular being Pointe Tarare and a functionary who is a Chevalier de la L??gion d'Honneur has been appointed to supervise all aspects of sunning in the buff. [SEP] There are no people who sun in the bluff.,invariance,1.0,1.0,1.0,1.0,1.0,False,
mnli_bench_0067,mnli,nli,semantic_role_sensitivity,Tourist Information offices can be very helpful. [SEP] Tourist Information offices are never of any help.,Tourist Information offices can be very helpful. [SEP] Tourist Information offices are never of any help.,invariance,1.0,1.0,1.0,1.0,1.0,False,
mnli_bench_0068,mnli,nli,semantic_role_sensitivity,yes uh i bought a uh Bristol thirty five five for my wife [SEP] I bought the Bristol from the old pawn shop near the docks.,yes uh i bought a uh Bristol thirty five five for my wife [SEP] I bought the Bristol from the old pawn shop near the docks.,invariance,1.0,1.0,1.0,1.0,1.0,False,
mnli_bench_0069,mnli,nli,semantic_role_sensitivity,Nabatean trading town on the route from Gaza to Petra . [SEP] Many exotic goods are for sale in the town.,Nabatean trading town on the route from Gaza to Petra . [SEP] Many exotic goods are for sale in the town.,invariance,1.0,1.0,1.0,1.0,1.0,False,
mnli_bench_0070,mnli,nli,semantic_role_sensitivity,(Imagine the difference between smoking a cigarette and injecting pure nicotine directly into a vein.) [SEP] Picture injecting nicotine into a vein compared to smoking a cigarette.,(Imagine the difference between smoking a cigarette and injecting pure nicotine directly into a vein.) [SEP] Picture injecting nicotine into a vein compared to smoking a cigarette.,invariance,1.0,1.0,1.0,1.0,1.0,False,
mnli_bench_0071,mnli,nli,semantic_role_sensitivity,"Have her show it,"" said Thorn. [SEP] Thorn said she should show her new sword.","Have her show it,"" said Thorn. [SEP] Thorn said she should show her new sword.",invariance,1.0,1.0,1.0,1.0,1.0,False,
mnli_bench_0072,mnli,nli,semantic_role_sensitivity,And she came to you? [SEP] The woman asked if he came to her.,And she came to you? [SEP] The woman asked if he came to her.,invariance,1.0,1.0,1.0,1.0,1.0,False,
mnli_bench_0073,mnli,nli,semantic_role_sensitivity,Per week? [SEP] Every day.,Per week? [SEP] Every day.,invariance,1.0,1.0,1.0,1.0,1.0,False,
mnli_bench_0074,mnli,nli,semantic_role_sensitivity,"Although I'm certain it amused Scott Shuger (an amusing guy, to judge by the terrific Today's Papers) to join the ranks of those who have publicly disparaged Linda Tripp, the fact remains that nothing in his piece, , reflects at all on Tripp herself. [SEP] I know it amused Shuger to join the people ripping Linda Tripp apart.","Although I'm certain it amused Scott Shuger (an amusing guy, to judge by the terrific Today's Papers) to join the ranks of those who have publicly disparaged Linda Tripp, the fact remains that nothing in his piece, , reflects at all on Tripp herself. [SEP] I know it amused Shuger to join the people ripping Linda Tripp apart.",invariance,1.0,1.0,1.0,1.0,1.0,False,
mnli_bench_0075,mnli,nli,semantic_role_sensitivity,"Ocho Rios is Spanish for  eight rivers,  but this name is not descriptive of the area. [SEP] Ocho Rios means pink penguins in Spanish, and this name describes the area.","Ocho Rios is Spanish for  eight rivers,  but this name is not descriptive of the area. [SEP] Ocho Rios means pink penguins in Spanish, and this name describes the area.",invariance,1.0,1.0,1.0,1.0,1.0,False,
mnli_bench_0076,mnli,nli,semantic_role_sensitivity,IQ boosting was achieved through a fetal replacement process where the embryos from two carefully selected mothers were to be switched from one to another. [SEP] IQ boosting can be done through fetal replacement in the first trimester.,IQ boosting was achieved through a fetal replacement process where the embryos from two carefully selected mothers were to be switched from one to another. [SEP] IQ boosting can be done through fetal replacement in the first trimester.,invariance,1.0,1.0,1.0,1.0,1.0,False,
mnli_bench_0077,mnli,nli,semantic_role_sensitivity,"In an effort to more thoroughly explore this topic, we expanded our discussions beyond the eight organizations that were the primary subjects of our study by requesting the Computer Security Institute to informally poll its most active members on this subject. [SEP] The Computer Security Institute is the most helpful organization for this discussion.  ","In an effort to more thoroughly explore this topic, we expanded our discussions beyond the eight organizations that were the primary subjects of our study by requesting the Computer Security Institute to informally poll its most active members on this subject. [SEP] The Computer Security Institute is the most helpful organization for this discussion.  ",invariance,1.0,1.0,1.0,1.0,1.0,False,
mnli_bench_0078,mnli,nli,semantic_role_sensitivity,um yeah we've tried to do that we've paid ours off you know all the way down to where we had everything down to zero and especially right before i i quit work two years ago to stay home with the kids [SEP] We did not pay ours off at any time.  ,um yeah we've tried to do that we've paid ours off you know all the way down to where we had everything down to zero and especially right before i i quit work two years ago to stay home with the kids [SEP] We did not pay ours off at any time.  ,invariance,1.0,1.0,1.0,1.0,1.0,False,
mnli_bench_0079,mnli,nli,semantic_role_sensitivity,"The Indigenous Project, a new program run by the Oregon Law Center, is one of only a handful of places in the United States where indigenous farmworkers from Mexico and Central America can find free and confidential legal aid. [SEP] The Indigenous Project is run by the Oregon Law Center in Portland.","The Indigenous Project, a new program run by the Oregon Law Center, is one of only a handful of places in the United States where indigenous farmworkers from Mexico and Central America can find free and confidential legal aid. [SEP] The Indigenous Project is run by the Oregon Law Center in Portland.",invariance,1.0,1.0,1.0,1.0,1.0,False,
mnli_bench_0080,mnli,nli,semantic_role_sensitivity,A recorded menu will provide information on how to obtain these lists. [SEP] These menus are created by experts. ,A recorded menu will provide information on how to obtain these lists. [SEP] These menus are created by experts. ,invariance,1.0,1.0,1.0,1.0,1.0,False,
mnli_bench_0081,mnli,nli,semantic_role_sensitivity,"Did Meriwether Lewis really commit suicide, as historians claim? [SEP] Was Lewis' death a suicide, as has been said by historians?","Did Meriwether Lewis really commit suicide, as historians claim? [SEP] Was Lewis' death a suicide, as has been said by historians?",invariance,1.0,1.0,1.0,1.0,1.0,False,
mnli_bench_0082,mnli,nli,semantic_role_sensitivity,Perhaps tax reform doesn't appeal to the new spiritualized side of Bradley. [SEP] Bradley don't have spiritual beliefs.,Perhaps tax reform doesn't appeal to the new spiritualized side of Bradley. [SEP] Bradley don't have spiritual beliefs.,invariance,1.0,1.0,1.0,1.0,1.0,False,
mnli_bench_0083,mnli,nli,semantic_role_sensitivity,The Data Warehousing Institute provides education and training in the data warehousing and business intelligence industry. [SEP] The Data Warehousing Institute provides guidance only in carpentry industry.,The Data Warehousing Institute provides education and training in the data warehousing and business intelligence industry. [SEP] The Data Warehousing Institute provides guidance only in carpentry industry.,invariance,1.0,1.0,1.0,1.0,1.0,False,
mnli_bench_0084,mnli,nli,semantic_role_sensitivity,The last stages of uploading are like a mental dry-heave. [SEP] The final part of uploading feels like a mental dry-heave.,The last stages of uploading are like a mental dry-heave. [SEP] The final part of uploading feels like a mental dry-heave.,invariance,1.0,1.0,1.0,1.0,1.0,False,
mnli_bench_0085,mnli,nli,semantic_role_sensitivity,"Using a threestep development planning process, managers assess their current capabilities, determine their specific development needs, and build and execute a development plan. [SEP] Building and executing a development plan is impossible.","Using a threestep development planning process, managers assess their current capabilities, determine their specific development needs, and build and execute a development plan. [SEP] Building and executing a development plan is impossible.",invariance,1.0,1.0,1.0,1.0,1.0,False,
mnli_bench_0086,mnli,nli,semantic_role_sensitivity,yeah plus uh you know look at the you know the besides the pollution the the aspect of invasion of privacy there's a big pollution aspect too i find i throw out a lot of those flyers and i have no interest in [SEP] I have even considered getting a dog to prevent people from putting flyers on my door.,yeah plus uh you know look at the you know the besides the pollution the the aspect of invasion of privacy there's a big pollution aspect too i find i throw out a lot of those flyers and i have no interest in [SEP] I have even considered getting a dog to prevent people from putting flyers on my door.,invariance,1.0,1.0,1.0,1.0,1.0,False,
mnli_bench_0087,mnli,nli,semantic_role_sensitivity,This is Susan. [SEP] Susan is who this is. ,This is Susan. [SEP] Susan is who this is. ,invariance,1.0,1.0,1.0,1.0,1.0,False,
mnli_bench_0088,mnli,nli,semantic_role_sensitivity,"However, assuming the procedural requirements of Chapter 36 are met, changes negotiated by the Postal Service and a mail user for their mutual benefit may merit recommendation under the applicable statutory standards. [SEP] Changes negotiated by the Postal Service and a mail user for their mutual benefit may merit recommendation under the applicable statutory standards.","However, assuming the procedural requirements of Chapter 36 are met, changes negotiated by the Postal Service and a mail user for their mutual benefit may merit recommendation under the applicable statutory standards. [SEP] Changes negotiated by the Postal Service and a mail user for their mutual benefit may merit recommendation under the applicable statutory standards.",invariance,1.0,1.0,1.0,1.0,1.0,False,
mnli_bench_0089,mnli,nli,semantic_role_sensitivity,"It spoke of thousands of years, even before the times of the old empire. [SEP] The old Empire is still ongoing.","It spoke of thousands of years, even before the times of the old empire. [SEP] The old Empire is still ongoing.",invariance,1.0,1.0,1.0,1.0,1.0,False,
mnli_bench_0090,mnli,nli,semantic_role_sensitivity,"A portion of the nation's income, in turn, is saved, allowing for additional investment in domestic factories, equipment, and other forms of capital that workers use to produce more goods and services or for investment abroad. [SEP] All of the nation's income should be spent on construction.","A portion of the nation's income, in turn, is saved, allowing for additional investment in domestic factories, equipment, and other forms of capital that workers use to produce more goods and services or for investment abroad. [SEP] All of the nation's income should be spent on construction.",invariance,1.0,1.0,1.0,1.0,1.0,False,
mnli_bench_0091,mnli,nli,semantic_role_sensitivity,Accusations of corruption among officials in Rao's administration in 1995 also paved the way for a comeback. [SEP] Nobody accused any officials in Rao's administration of corruption in 1995.,Accusations of corruption among officials in Rao's administration in 1995 also paved the way for a comeback. [SEP] Nobody accused any officials in Rao's administration of corruption in 1995.,invariance,1.0,1.0,1.0,1.0,1.0,False,
mnli_bench_0092,mnli,nli,semantic_role_sensitivity,Overlapping the others? [SEP] Overlapping the other photos?,Overlapping the others? [SEP] Overlapping the other photos?,invariance,1.0,1.0,1.0,1.0,1.0,False,
mnli_bench_0093,mnli,nli,semantic_role_sensitivity,"On Samothrakia you can climb to the summit of Mount Fengari, where the God Poseidon watched the Trojan War reach its tragic climax. [SEP] The summit of Mount Fengari are off limits and you cannot climb to it.","On Samothrakia you can climb to the summit of Mount Fengari, where the God Poseidon watched the Trojan War reach its tragic climax. [SEP] The summit of Mount Fengari are off limits and you cannot climb to it.",invariance,1.0,1.0,1.0,1.0,1.0,False,
mnli_bench_0094,mnli,nli,semantic_role_sensitivity,"Last year, that campaign - primarily among private attorneys - drew less than $40,000 while the Nashville legal aid fund-raising garnered more than $500,000. [SEP] The Memphis campaign was tiny compared to Nashville's ","Last year, that campaign - primarily among private attorneys - drew less than $40,000 while the Nashville legal aid fund-raising garnered more than $500,000. [SEP] The Memphis campaign was tiny compared to Nashville's ",invariance,1.0,1.0,1.0,1.0,1.0,False,
mnli_bench_0095,mnli,nli,semantic_role_sensitivity,"As a result of the comments received, AMS changed the proposed rule and it was republished for comment in March 2000. [SEP] The new version of the rule closed certain loopholes.","As a result of the comments received, AMS changed the proposed rule and it was republished for comment in March 2000. [SEP] The new version of the rule closed certain loopholes.",invariance,1.0,1.0,1.0,1.0,1.0,False,
mnli_bench_0096,mnli,nli,semantic_role_sensitivity,need the car the next day type deal so [SEP] You need the car several weeks later.,need the car the next day type deal so [SEP] You need the car several weeks later.,invariance,1.0,1.0,1.0,1.0,1.0,False,
mnli_bench_0097,mnli,nli,semantic_role_sensitivity, Two more weeks with my cute TV satellite dish have increased my appreciation of it. [SEP] I've got two more weeks to decided if I wanna keep it or return it., Two more weeks with my cute TV satellite dish have increased my appreciation of it. [SEP] I've got two more weeks to decided if I wanna keep it or return it.,invariance,1.0,1.0,1.0,1.0,1.0,False,
mnli_bench_0098,mnli,nli,semantic_role_sensitivity,The credibility of the United States working with its European partners in NATO is on the line. [SEP] The United States currently enjoys high favorability among its European allies who trust it completely.,The credibility of the United States working with its European partners in NATO is on the line. [SEP] The United States currently enjoys high favorability among its European allies who trust it completely.,invariance,1.0,1.0,1.0,1.0,1.0,False,
mnli_bench_0099,mnli,nli,semantic_role_sensitivity,well his knees were bothering him yeah [SEP] He was in tip-top condition.,well his knees were bothering him yeah [SEP] He was in tip-top condition.,invariance,1.0,1.0,1.0,1.0,1.0,False,
mnli_bench_0100,mnli,nli,semantic_role_sensitivity,They are all quotations from the Old Testament Book of Aunt Ruth. [SEP] The Old Testament was read to the children in the church.,They are all quotations from the Old Testament Book of Aunt Ruth. [SEP] The Old Testament was read to the children in the church.,invariance,1.0,1.0,1.0,1.0,1.0,False,
mnli_bench_0101,mnli,nli,semantic_role_sensitivity,"These days, newspaper writers are no longer allowed the kind of license he took. [SEP] Newspaper writers need to be more factual and careful these days.","These days, newspaper writers are no longer allowed the kind of license he took. [SEP] Newspaper writers need to be more factual and careful these days.",invariance,1.0,1.0,1.0,1.0,1.0,False,
mnli_bench_0102,mnli,nli,semantic_role_sensitivity,I am not. [SEP] I am.,I am not. [SEP] I am.,invariance,1.0,1.0,1.0,1.0,1.0,False,
mnli_bench_0103,mnli,nli,semantic_role_sensitivity,"Jon was fighting at full speed, sweat forming on his brow. [SEP] Jon was fighting demons at full speed.","Jon was fighting at full speed, sweat forming on his brow. [SEP] Jon was fighting demons at full speed.",invariance,1.0,1.0,1.0,1.0,1.0,False,
mnli_bench_0104,mnli,nli,semantic_role_sensitivity,"The oldest continually occupied settlement on the island is Kastro, where most of the buildings date from the 14th century and were laid out in a circular pattern atop a rocky outcrop 100 m (300 ft) above the east coast. [SEP] Most of the houses on Kastro date back to the 14th century.","The oldest continually occupied settlement on the island is Kastro, where most of the buildings date from the 14th century and were laid out in a circular pattern atop a rocky outcrop 100 m (300 ft) above the east coast. [SEP] Most of the houses on Kastro date back to the 14th century.",invariance,1.0,1.0,1.0,1.0,1.0,False,
mnli_bench_0105,mnli,nli,semantic_role_sensitivity,"yeah really no kidding [SEP] Oh, you're just joking. ","yeah really no kidding [SEP] Oh, you're just joking. ",invariance,1.0,1.0,1.0,1.0,1.0,False,
mnli_bench_0106,mnli,nli,semantic_role_sensitivity,She's smiling but her eyes are closed. [SEP] Her eyes would not open but she is smiling.,She's smiling but her eyes are closed. [SEP] Her eyes would not open but she is smiling.,invariance,1.0,1.0,1.0,1.0,1.0,False,
mnli_bench_0107,mnli,nli,semantic_role_sensitivity,"we were talking . Try to behave [SEP] We are having an argument, come at me if you dare!","we were talking . Try to behave [SEP] We are having an argument, come at me if you dare!",invariance,1.0,1.0,1.0,1.0,1.0,False,
mnli_bench_0108,mnli,nli,semantic_role_sensitivity,The management of the cafe has established the rules for the use of their facility. [SEP] The management of the cafe enforces a strict dress code.,The management of the cafe has established the rules for the use of their facility. [SEP] The management of the cafe enforces a strict dress code.,invariance,1.0,1.0,1.0,1.0,1.0,False,
mnli_bench_0109,mnli,nli,semantic_role_sensitivity,"As he emerged, Boris remarked, glancing up at the clock: ""You are early. [SEP] Boris remarked, glancing at the clock, 'You are late.'","As he emerged, Boris remarked, glancing up at the clock: ""You are early. [SEP] Boris remarked, glancing at the clock, 'You are late.'",invariance,1.0,1.0,1.0,1.0,1.0,False,
mnli_bench_0110,mnli,nli,semantic_role_sensitivity,"Guangzhou, with a population of more than 5 million, straddles the Pearl River China's fifth longest which links the city to the South China Sea. [SEP] Pearl River is the fifth longest river in China.","Guangzhou, with a population of more than 5 million, straddles the Pearl River China's fifth longest which links the city to the South China Sea. [SEP] Pearl River is the fifth longest river in China.",invariance,1.0,1.0,1.0,1.0,1.0,False,
mnli_bench_0111,mnli,nli,semantic_role_sensitivity,oh wow no i just started about well five years ago i think [SEP] It had started five years ago.,oh wow no i just started about well five years ago i think [SEP] It had started five years ago.,invariance,1.0,1.0,1.0,1.0,1.0,False,
mnli_bench_0112,mnli,nli,semantic_role_sensitivity,"These runs could cost far more than the value of the small improvement in service. [SEP] The runs would cost $36,000.","These runs could cost far more than the value of the small improvement in service. [SEP] The runs would cost $36,000.",invariance,1.0,1.0,1.0,1.0,1.0,False,
mnli_bench_0113,mnli,nli,semantic_role_sensitivity,We know essentially nothing about life beyond Earth. [SEP] We know everything about life beyond Earth. ,We know essentially nothing about life beyond Earth. [SEP] We know everything about life beyond Earth. ,invariance,1.0,1.0,1.0,1.0,1.0,False,
